ID,Votes,Title,Year,Released,Runtime,Genre,Director,Writer,Actors,Plot,Country,Awards,RT_Ratings,Metascore,imdbRating,imdbVotes,imdbID,Type,BoxOffice,Production
tt7578566,963,Scooby-Doo & Batman: The Brave and the Bold,2018,09 Jan 2018,75 min,"Animation, Action, Comedy, Crime, Family, Horror, Mystery",Jake Castorena,"James Tucker (story by), Paul Giacoppo (teleplay by), Joseph Barbera (based on characters created by), William Hanna (based on characters created by), Bob Kane (based on characters created by: Batman), Bill Finger (based on characters created by: Batman), Paul Norris (character created by: Aquaman), Joe Samachson (character created by: Martian Manhunter), Joe Certa (character created by: Martian Manhunter), Jack Cole (character created by: Plastic Man), Paul Dini (character created by: Harley Quinn), Bruce Timm (character created by: Harley Quinn), Steve Ditko (character created by: The Question)","Frank Welker, Grey Griffin, Matthew Lillard, Diedrich Bader",Batman teams up with the Scooby Doo gang when villains from both of their worlds unite to wreak havoc on the city.,USA,N/A,,N/A,6.7,940,tt7578566,movie,N/A,N/A
tt7581572,1759,Sudani from Nigeria,2018,23 Mar 2018,123 min,"Comedy, Sport",Zakariya,"Muhsin Parari (dialogue), Zakariya (dialogue), Zakariya (screenplay)","Soubin Shahir, Samuel Abiola Robinson, Savithri Sredharan, Sarasa Balussery","Story of an African football player and a local football club manager from Malappuram, Kerala.",India,N/A,,N/A,8.3,"1,539",tt7581572,movie,N/A,N/A
tt7581902,15555,Sonu Ke Titu Ki Sweety,2018,23 Feb 2018,138 min,"Comedy, Romance",Luv Ranjan,"Rahul Mody, Luv Ranjan","Kartik Aaryan, Nushrat Bharucha, Sunny Singh Nijjar, Alok Nath",Titu is going to marry a perfect woman named Sweety. Titu's best-friend Sonu doubts Sweety's character and tries to break the marriage while Sweety tries to do opposite and which leads to war between Bromance and Romance.,India,N/A,44%,N/A,7.1,"15,245",tt7581902,movie,N/A,Luv Films
tt7582962,593,Parole,2018,31 Mar 2018,N/A,Drama,Sharrath Sandith,Ajith Poojappura,"Mia George, Mammootty, Pallavi",Parole is a Malayalam movie starring Mammootty in a prominent role. The cast also includes Pallavi. It is a drama directed by Sharrath Sandith.,India,N/A,,N/A,N/A,N/A,tt7582962,movie,N/A,N/A
tt7585270,887,Theevandi,2018,07 Sep 2018,144 min,Comedy,Fellini T.P.,Vini Vishwa Lal,"Tovino Thomas, Samyuktha Menon, Suraaj Venjarammoodu, Vijilesh Karayad",Theevandi is a political satire depicted through light humor where the protagonist Bineesh hardly knows a thing even about himself.,India,N/A,,N/A,6.8,821,tt7585270,movie,N/A,N/A
tt7589670,601,Chalo,2018,02 Feb 2018,145 min,"Action, Comedy, Family",Venky Kudumula,"Venky Kudumula (dialogue), Venky Kudumula (screenplay), Venky Kudumula (story)","Naga Shaurya, Rashmika Mandanna, Achyuth Kumar, Mime Gopi","The film revolves around a village called ""Tiruppuram"" which is divided into half by the Tamil and Telugu people. Neither of the groups cross and enter the other's perimeter.",India,N/A,,N/A,7.0,247,tt7589670,movie,N/A,Ira Creations
tt7597486,624,Norske byggeklosser,2018,21 Feb 2018,99 min,Comedy,Arild Fröhlich,"Atle Antonsen, Arild Fröhlich","Atle Antonsen, Anders Baasmo Christiansen, Anne Marit Jacobsen, Ine F. Jansen","A modern take of the classic Norwegian movie where our main characters meet unforeseen troubles and bureaucracy when they refurbish an inherited house, to get away from a mad mother. A hopeless and hilarious meet with the system.",Norway,N/A,,N/A,5.9,575,tt7597486,movie,N/A,N/A
tt7601308,617,Ira,2018,16 Mar 2018,139 min,"Crime, Mystery, Thriller",Saiju S.S.,Naveen John,"Unni Mukundan, Gokul Suresh Gopi, Shankar Ramakrishnan, Niranjana Anoop","Aryan is like every other lover, who finds the world a better place just because of that one person. Life takes a sudden twist when he is implicated of a serious crime which he didn't commit and Rajeev who comes as a savior in his life.",India,N/A,,N/A,7.1,550,tt7601308,movie,N/A,N/A
tt7605922,1555,My Masterpiece,2018,16 Aug 2018,100 min,Comedy,Gastón Duprat,"Andrés Duprat, Gastón Duprat","Guillermo Francella, Luis Brandoni, Raúl Arévalo, Andrea Frigerio","Arturo is an unscrupulous art dealer and Renzo his socially-awkward painter and longtime friend. Willing to risk it all, they develop an extreme and ludicrous plan to save themselves.","Argentina, Spain",N/A,86%,N/A,7.1,883,tt7605922,movie,N/A,Arco Libre
tt7607940,1977,Namaste England,2018,19 Oct 2018,141 min,"Comedy, Drama, Romance",Vipul Amrutlal Shah,"Suresh Nair, Ritesh Shah","Parineeti Chopra, Arjun Kapoor, Sonia Goswami, Hiten Patel","An Indian couple go to great lengths to move to London, England.",India,N/A,0%,N/A,1.5,"1,908",tt7607940,movie,N/A,Reliance Entertainment
tt7608028,24169,The Open House,2018,19 Jan 2018,94 min,"Horror, Thriller","Matt Angel, Suzanne Coote","Matt Angel, Suzanne Coote","Dylan Minnette, Piercey Dalton, Patricia Bethune, Sharif Atkins",A teenager and his mother find themselves besieged by threatening forces when they move into a new house.,USA,N/A,18%,N/A,3.3,"23,865",tt7608028,movie,N/A,Netflix
tt7609114,782,Yamla Pagla Deewana Phir Se...,2018,31 Aug 2018,145 min,"Action, Comedy",Navaniat Singh,"Dheeraj Rattan (story and screenplay), Bunty Rathore (dialogue), Vankush Arora (dialogue), Anant Ahluwalia (additional dialogue)","Dharmendra, Sunny Deol, Bobby Deol, Kriti Kharbanda","Inheriting from the ancestors, the legacy of the Ayurveda panacea 'Vajrakavach', a famed and effective remedy for all ills, the brother duo Pooran and Kaala use the kavach with varied ...",India,N/A,13%,N/A,5.2,772,tt7609114,movie,N/A,ZEE Studios International
tt7610196,746,Do Women Have A Higher Sex Drive?,2018,05 Jun 2018,70 min,Documentary,"Jan-Willem Breure, Anouk Pluijm, Cheyenne Löhnen(co-director)","Jan-Willem Breure, Cheyenne Löhnen, Anouk Pluijm","Cheyenne Löhnen, Annine van der Meer, Dian Biemans, Nicole Caldwell","The film explores the the scientific, historical, biological and social aspects behind the female sex drive and female gaze.",Netherlands,N/A,,N/A,7.2,735,tt7610196,movie,N/A,N/A
tt7618184,11153,Mulk,2018,03 Aug 2018,140 min,Drama,Anubhav Sinha,"Mustafa Neemuchwala (Associate to the Writer), Anubhav Sinha","Tapsee Pannu, Rishi Kapoor, Prateik, Ashutosh Rana",One family member tries to help her own family which are trapped in a dark controversy.,India,N/A,86%,N/A,6.3,"11,058",tt7618184,movie,N/A,Benaras Media Works
tt7628458,2139,Hadi Be Oglum,2018,26 Jan 2018,N/A,Drama,Bora Egemen,N/A,"Kivanç Tatlitug, Büsra Develi, Alihan Türkdemir",N/A,Turkey,N/A,,N/A,N/A,N/A,tt7628458,movie,N/A,N/A
tt7632930,888,Trener,2018,19 Apr 2018,138 min,"Drama, Sport",Danila Kozlovsky,"Sergey Chetverukhin, Danila Kozlovsky, Andrey Zolotarev","Vitaliy Andreev, Oleg Androsov, Vilen Babichev, Dmitrii Chebotarev","Contemporary Russia. After he flubs a penalty kick, a humiliated national soccer player quits the game. He flees to a small town, where he decides to coach their local team.",Russia,N/A,,N/A,6.4,819,tt7632930,movie,N/A,N/A
tt7638344,7943,Dhadak,2018,20 Jul 2018,138 min,"Comedy, Drama, Romance",Shashank Khaitan,"Shashank Khaitan (screenplay), Nagraj Manjule (story)","Janhvi Kapoor, Ishaan Khattar, Ashutosh Rana, Shalini Kapoor","Set in Rajasthan, this love story explores how the protagonists deal with issues like differences between castes and honor killings.",India,N/A,36%,N/A,4.5,"7,835",tt7638344,movie,N/A,Zee Studios
tt7648416,590,Io c'è,2018,29 Mar 2018,100 min,Comedy,Alessandro Aronadio,"Alessandro Aronadio (screenplay), Alessandro Aronadio (story), Valerio Cilio (screenplay), Edoardo Leo (screenplay), Edoardo Leo (story), Renato Sannio (screenplay), Renato Sannio (story)","Edoardo Leo, Margherita Buy, Giuseppe Battiston, Giulia Michelini","To save his B&B from a failure, Massimo decides to turn it into a place of worship creating a new religion.",Italy,N/A,,N/A,6.3,583,tt7648416,movie,N/A,N/A
tt7654872,552,L'Envers du décor,2018,25 Apr 2018,N/A,Comedy,Daniel Auteuil,Florian Zeller,"Gérard Depardieu, Adriana Ugarte, Daniel Auteuil, Sandrine Kiberlain",N/A,France,N/A,,N/A,N/A,N/A,tt7654872,movie,N/A,N/A
tt7664504,13207,Three Identical Strangers,2018,30 Nov 2018,96 min,"Documentary, Biography, Drama, Mystery",Tim Wardle,N/A,"Robert Shafran, Michael Domnitz, Howard Schneider, Ellen Cervone","In 1980 New York, three young men who were all adopted meet each other and find out they're triplets who were separated at birth. But their quest to find out why turns into a bizarre and sinister mystery.",UK,1 win & 3 nominations.,96%,81,7.7,"12,312",tt7664504,movie,N/A,NEON
tt7665476,675,The Trial,2018,01 Feb 2018,100 min,Documentary,Maria Ramos,Maria Ramos (concept),"Dilma Rousseff, Michel Temer, José Eduardo Cardozo","The Trial portrays the trial of Dilma Rousseff, focusing on the defense team, who struggles to prove her innocence against a majority vote by a Congress riddled with corruption. A tale of ...",Brazil,N/A,,N/A,7.0,17,tt7665476,movie,N/A,N/A
tt7668724,656,The Marine 6: Close Quarters,2018,26 Oct 2018,85 min,"Action, Drama",James Nunn,Craig Walendziak,"Mike 'The Miz' Mizanin, Shawn Michaels, Rebecca Quin, Louisa Connolly-Burnham","Jake Carter and another former Marine, Luke Trapper, join forces to rescue a kidnapped girl from a gang of international criminals.",USA,N/A,,N/A,4.9,638,tt7668724,movie,N/A,WWE
tt7668842,51191,Enes Batur Hayal mi Gerçek mi?,2018,19 Jan 2018,110 min,Comedy,Kamil Cetin,"Enes Batur (story), Busra Nur Karahan, Enver Sülük","Enes Batur, Bilal Hanci, Atakan Özyurt, Fatih Yasin",Enes Batur has to decide between going to college or being a professional Youtuber.,Turkey,N/A,,N/A,5.9,"50,626",tt7668842,movie,N/A,N/A
tt7668870,86787,Searching,2018,31 Aug 2018,102 min,"Drama, Mystery, Thriller",Aneesh Chaganty,"Aneesh Chaganty, Sev Ohanian","John Cho, Sara Sohn, Alex Jayne Go, Megan Liu","After his 16-year-old daughter goes missing, a desperate father breaks into her laptop to look for clues to find her.","Russia, USA",1 win & 1 nomination.,92%,71,7.7,"86,665",tt7668870,movie,N/A,Screen Gems
tt7675404,1073,1968,2018,25 Jan 2018,N/A,"Documentary, History, Sport",Tassos Boulmetis,Tassos Boulmetis,"Alexandros Amerikanos, Antonis Antoniou, Maria Antoulinaki, Orfeas Avgoustidis","A.E.K., the well-known Greek basketball team founded in 1924 by refugees from Constantinople, after 44 years, beats SLAVIA of Prague and wins the European Cup.",Greece,N/A,,N/A,8.4,"1,001",tt7675404,movie,N/A,N/A
tt7679126,585,The Best Summer of My Life,2018,12 Jul 2018,91 min,"Comedy, Family",Dani de la Orden,"Olatz Arroyo, Daniel Castro, Dani de la Orden, Marta Suárez","Leo Harlem, Toni Acosta, Maggie Civantos, Jordi Sánchez","An unlucky salesman tries to fulfill the promise given to his son of giving him an unforgettable summer holidays, despite he hasn't money.",Spain,N/A,,N/A,5.8,544,tt7679126,movie,N/A,Álamo Audiovisual
tt7681824,2317,We the Animals,2018,17 Aug 2018,94 min,Drama,Jeremiah Zagar,"Daniel Kitrosser, Justin Torres (based on the novel by), Jeremiah Zagar","Sheila Vand, Raúl Castillo, Evan Rosado, Josiah Gabriel","Manny, Joel, and Jonah tear their way through childhood and push against the volatile love of their parents. As Manny and Joel grow into versions of their father and Ma dreams of escape, Jonah embraces an imagined world all on his own.",USA,1 nomination.,91%,84,6.9,"2,174",tt7681824,movie,N/A,The Orchard
tt7681902,15563,Won't You Be My Neighbor?,2018,29 Jun 2018,94 min,"Documentary, Biography",Morgan Neville,N/A,"Fred Rogers, Joanne Rogers, John Rogers, Jim Rogers","An exploration of the life, lessons, and legacy of iconic children's television host, Fred Rogers.",USA,N/A,98%,85,8.4,"15,544",tt7681902,movie,N/A,Focus Features
tt7681970,667,After Porn Ends 3,2018,30 Oct 2018,86 min,Documentary,Brittany Andrews,N/A,"Buck Angel, Joanna Angel, Christy Canyon, Manuel Ferrara",After Porn Ends 3 continues to explore whether a career as an adult performer is inherently damaging to the balance of a perfomer's life once retired.,USA,N/A,,N/A,5.4,654,tt7681970,movie,N/A,N/A
tt7689424,590,Believer,2018,25 Jun 2018,101 min,"Documentary, Music",Don Argott,N/A,"Dan Reynolds, Aja Volkman, Ben McKee, Daniel Platzman",Imagine Dragons' Mormon front man Dan Reynolds is taking on a new mission to explore how the Church treats its LGBTQ members. With the rising suicide rate amongst teens in the state of Utah...,USA,1 nomination.,64%,N/A,7.2,586,tt7689424,movie,N/A,HBO Documentary Films
tt7689906,1064,Monsters and Men,2018,28 Sep 2018,96 min,"Crime, Drama, Thriller",Reinaldo Marcus Green,Reinaldo Marcus Green,"John David Washington, Anthony Ramos, Kelvin Harrison Jr., Chanté Adams","The aftermath of a police killing of a black man, told through the eyes of the bystander who filmed the act, an African-American police officer and a high-school baseball phenom inspired to take a stand.",USA,1 nomination.,86%,68,5.5,"1,048",tt7689906,movie,N/A,NEON
tt7689924,814,Seeing Allred,2018,09 Feb 2018,96 min,Documentary,"Roberta Grossman, Sophie Sartain",N/A,"Gloria Allred, Lisa Bloom, Bill Cosby, Roy Moore",Women's rights attorney Gloria Allred takes on the biggest names in American culture as coverage of sexual assault allegations in the media become more prevalent.,USA,1 nomination.,100%,68,6.7,810,tt7689924,movie,N/A,Netflix
tt7689936,1043,The Cleaners,2018,17 May 2018,88 min,Documentary,"Hans Block, Moritz Riesewieck","Hans Block, Moritz Riesewieck, Georg Tschurtschenthaler","Mark Zuckerberg, Donald Trump, Nicole Wong, Sarah T. Roberts",A look at the shadowy underworld of the Internet where questionable content is removed.,"Germany, Brazil, Netherlands, Italy, USA, Japan, UK, Sweden, Austria, Switzerland, Denmark, Canada",1 nomination.,92%,70,7.3,999,tt7689936,movie,N/A,Gebrueder Beetz Filmproduktion
tt7689958,1077,Jane Fonda in Five Acts,2018,24 Sep 2018,133 min,Documentary,Susan Lacy,N/A,"Dick Cavett, Jane Fonda, Troy Garity, Tom Hayden","A look at the life, work, activism and controversies of actress and fitness tycoon, Jane Fonda.",USA,N/A,96%,87,7.9,688,tt7689958,movie,N/A,N/A
tt7689964,7215,RBG,2018,14 Sep 2018,98 min,"Documentary, Biography","Julie Cohen, Betsy West",N/A,"Bill Clinton, Sharron Frontiero, James Steven Ginsburg, Jane C. Ginsburg","The exceptional life and career of U.S. Supreme Court Justice Ruth Bader Ginsburg, who has developed a breathtaking legal legacy while becoming an unexpected pop culture icon.",USA,1 nomination.,94%,71,7.5,"6,656",tt7689964,movie,N/A,Magnolia Pictures
tt7689966,4567,Robin Williams: Come Inside My Mind,2018,16 Jul 2018,116 min,"Documentary, Biography, Comedy",Marina Zenovich,N/A,"Robin Williams, Steve Allen, Robert Altman, Roseanne Barr","An intimate look into the life and work of the revered master comedian and actor, Robin Williams.",USA,N/A,96%,74,8.0,"4,418",tt7689966,movie,N/A,HBO Documentary Films
tt7690016,1417,Never Goin' Back,2018,03 Aug 2018,85 min,"Comedy, Crime, Drama",Augustine Frizzell,Augustine Frizzell,"Maia Mitchell, Camila Morrone, Liz Cardenas, Michelle Sherrill","Jessie and Angela, high school dropouts, are taking a week off to chill at the beach. Too bad their house got robbed, rent's due, they're about to get fired, and they're broke.",USA,1 win.,75%,62,5.9,"1,318",tt7690016,movie,N/A,A24
tt7690466,666,Gayatri,2018,N/A,125 min,"Drama, Family",Madan,"Diamond Ratna Babu (dialogue), Bayyavarapu Ravi","Ali, Rajsekhar Aningi, Giri Babu, Mohan Babu","Sivaji, a stage artist, finds whereabouts of his daughter who disappeared two decades ago and finds out that the kidnapper, Gayatri Patel, is an exact lookalike of him.",India,N/A,,N/A,8.2,658,tt7690466,movie,N/A,N/A
tt7690638,3412,Soorma,2018,13 Jul 2018,131 min,"Biography, Drama, Sport",Shaad Ali,"Shaad Ali, Siva Ananth, Adhir Bhat (additional dialogue), Suyash Trivedi","Diljit Dosanjh, Tapsee Pannu, Angad Bedi, Vijay Raaz","Soorma is the story of the triumph of the human spirit, about a player, who made headlines for his miraculous comeback after facing a near death experience through sheer determination, hard work and unrelenting passion for the sport.",India,N/A,67%,N/A,7.5,"3,197",tt7690638,movie,N/A,CS Films
tt7690670,4349,SuperFly,2018,13 Jun 2018,116 min,"Action, Crime, Thriller",Director X.,Alex Tse (screenplay by),"Trevor Jackson, Jason Mitchell, Michael Kenneth Williams, Lex Scott Davis","With retirement on his mind, a successful young drug dealer sets up one last big job, while dealing with trigger-happy colleagues and the police.",USA,N/A,52/100,52,5.1,"4,167",tt7690670,movie,N/A,N/A
tt7690762,654,The Pact,2018,17 Aug 2018,106 min,"Horror, Thriller",David Victori,"Jordi Vallejo, David Victori","Belén Rueda, Mireia Oriol, Darío Grandinetti, Antonio Durán 'Morris'",When Monica finds out her daughter is about to die she takes extreme measures to save her.,Spain,N/A,,N/A,5.4,612,tt7690762,movie,N/A,Ikiru Films
tt7695014,568,Saheb Biwi Aur Gangster 3,2018,27 Jul 2018,140 min,"Action, Crime, Drama, Thriller",Tigmanshu Dhulia,"Sanjay Chauhan, Tigmanshu Dhulia","Sanjay Dutt, Jimmy Sheirgill, Mahie Gill, Chitrangda Singh","The royal saga of deceit, conspiracy, greed and lust continues in the third installment of the series, as the Saheb and Biwi are pitted against an enemy and everyone involved is scheming ruthlessly for their own personal gain.",India,N/A,33%,N/A,4.5,559,tt7695014,movie,N/A,Jar Pictures
tt7700730,9825,October,2018,13 Apr 2018,115 min,"Drama, Romance",Shoojit Sircar,Juhi Chaturvedi,"Varun Dhawan, Banita Sandhu, Gitanjali Rao, Sahil Vedoliyaa",A group of interns are going through the usual grind when suddenly an accident changes their lives. The protagonist can't get let go of it and becomes obsessed with it. What does it all lead to? Is it love or something else?,India,N/A,89%,N/A,7.6,"9,600",tt7700730,movie,N/A,Grand Showbiz
tt7701808,1075,The Steam Engines of Oz,2018,20 Sep 2018,79 min,"Animation, Adventure, Family, Fantasy",Sean Patrick O'Reilly,Sean Patrick O'Reilly,"Matthew Kevin Anderson, Ashleigh Ball, Elijah Dhavvan, Geoff Gustafson","A century after the Wicked Witch, the Emerald City is at the mercy of a once-revered hero, and salvation comes from the wrench of young Victoria Wright. Rediscover old friends and meet new heroes in this new tale set in the Land of Oz.",Canada,N/A,,N/A,7.2,"1,074",tt7701808,movie,N/A,N/A
tt7705790,1517,TholiPrema,2018,08 Feb 2018,137 min,Romance,Venky Atluri,Venky Atluri,"Varun Tej, Raashi Khanna, Hyper Aadi, Daniel Eghan",A love story that weathers time and emotions. Aditya sees Varsha and it is love at first sight for him. What transpires over the next 7 years is what makes their love stronger.,India,N/A,,N/A,7.6,619,tt7705790,movie,N/A,N/A
tt7707314,792,Lionheart,2018,04 Jan 2019,95 min,Comedy,Genevieve Nnaji,"Ishaya Bako, Emil B. Garuba, C.J. 'Fiery' Obasi","Genevieve Nnaji, Nkem Owoh, Pete Edochie, Onyeka Onwenu","Running a company can be challenging, especially if you are a female in a male-dominated industry. Looking to prove her worth, Adaeze steps up to the challenge when her father is forced to take a step back due to health issues.",Nigeria,N/A,100%,N/A,5.7,774,tt7707314,movie,N/A,Netflix
tt7711342,2302,Agnyaathavaasi,2018,09 Jan 2018,158 min,"Action, Drama",Trivikram Srinivas,"Trivikram Srinivas (dialogue), Trivikram Srinivas (screenplay), Trivikram Srinivas","Pawan Kalyan, Keerthi Suresh, Anu Emmanuel, Aadhi","An exiled heir to billionaire, returns after his father was murdered, as a regular employee to find out the killers and make things right in his company.",India,N/A,,N/A,4.9,"2,292",tt7711342,movie,N/A,N/A
tt7715202,10445,Sarkar,2018,06 Nov 2018,163 min,"Action, Drama",A.R. Murugadoss,"Jayamohan (dialogue), A.R. Murugadoss (dialogue), A.R. Murugadoss (screenplay), A.R. Murugadoss (story), Thirukumaran","Joseph Vijay, Keerthi Suresh, Varalaxmi Sarathkumar, Joy Badlani",A successful businessman gets involved in a political battle with 2 notorious ministers regarding the issues of Tamil Nadu State.,India,N/A,,N/A,7.2,"10,275",tt7715202,movie,N/A,N/A
tt7717440,1034,The Legend of Muay Thai: 9 Satra,2018,11 Jan 2018,102 min,Animation,"Pongsa Kornsri, Gun Phansuwon, Nat Yoswatananont","Nat Yoswatananont (screenplay), Bryan Edward Hill (screenplay), Daraka Wongsiri (screenplay), Nat Yoswatananont (story), Suphakorn Riansuwan (story)","Kanokchat Manyaton, Savitree Suttichanond, Sirichai Charoenkijtanakul, Rachphol Yamsaeng","With ""Ott"" father's last hope to take back Ramthep City where is now occupy by Asura (Giant Race), the boy was trained the martial art of Muay Thai for the mission of delivering 9 Satra, ...",Thailand,N/A,,N/A,8.0,"1,007",tt7717440,movie,N/A,N/A
tt7719976,578,Sarvam Thaala Mayam,2018,01 Feb 2019,131 min,"Drama, Music",Rajiv Menon,Rajiv Menon,"G.V. Prakash Kumar, Aparna Balamurali, Nedumudi Venu, Vineeth",The film traces the life of Peter who is a Thalapathy fan aspiring to become a Mridangam Vidwan.,India,N/A,,N/A,8.8,44,tt7719976,movie,N/A,N/A
tt7720922,3763,Batti Gul Meter Chalu,2018,21 Sep 2018,161 min,"Comedy, Drama",Shree Narayan Singh,"Vipul K. Rawal (Original Story Concept), Siddharth Singh (adapted by), Garima Wahal (adapted by)","Shahid Kapoor, Shraddha Kapoor, Divyendu Sharma, Yami Gautam","The life of three friends takes a tragic turn due to an inflated electricity bill, which leads to a courtroom drama and social awakening.",India,N/A,14%,N/A,6.3,"3,684",tt7720922,movie,N/A,T-Series
tt7722258,704,Genius,2018,24 Aug 2018,165 min,"Action, Thriller",Anil Sharma,"Anil Sharma (story), Anil Sharma (screenplay and dialogue), Sunil Sirvaiya (screenplay and dialogue), Amjad Ali (screenplay and dialogue)","Utkarsh Sharma, Ishita Chauhan, Mithun Chakraborty, Ayesha Jhulka","An orphan, with a brilliant mind, joins RAW and is burdened by the killing of his entire team. Until he doesn't avenge their death, he can't live in peace with his love. So, he hatches a genius plan.",India,N/A,,N/A,4.8,688,tt7722258,movie,N/A,N/A
tt7725596,16537,Badhaai Ho,2018,19 Oct 2018,124 min,"Comedy, Drama",Amit Ravindernath Sharma,"Akshat Ghildial (screenplay and dialogue), Akshat Ghildial (story), Jyoti Kapoor (story), Shantanu Srivastava (story)","Ayushmann Khurrana, Sanya Malhotra, Neena Gupta, Gajraj Rao",A man faces embarrassment in the society when he finds out his mother is pregnant,India,N/A,88%,N/A,8.1,"16,507",tt7725596,movie,N/A,Junglee Pictures
tt7738450,6719,Thunder Road,2018,30 Oct 2018,92 min,"Comedy, Drama",Jim Cummings,Jim Cummings,"Jim Cummings, Kendal Farr, Nican Robinson, Jocelyn DeBoer",A police officer faces a personal meltdown following a divorce and the death of his mother.,USA,1 win.,98%,82,7.1,"6,006",tt7738450,movie,N/A,Vanishing Angle
tt7738594,581,Naachiyar,2018,16 Feb 2018,100 min,"Action, Drama, Thriller",Bala,Bala,"Jyothika, G.V. Prakash Kumar, Rockline Venkatesh","A police officer uncovers the truth about Kaathavarayan, a young man who is accused of assaulting his girlfriend.",India,N/A,,N/A,7.3,121,tt7738594,movie,N/A,N/A
tt7738784,9067,Peranbu,2018,01 Feb 2019,147 min,Drama,"Ram, Amudhavan Karuppiah(co-director), Anjana Krishnakumar(co-director)","Anjana Krishnakumar (dialogue writer), Ram","Mammootty, Sadhana, Anjali, Anjali Ameer",A story about a father who tries to understand the struggles of his disabled daughter Paapa. The plot highlights the journey of how he becomes a better man while he comes to terms with his child and her special needs.,India,N/A,,N/A,9.7,"8,553",tt7738784,movie,N/A,N/A
tt7738930,637,Üç Harfliler: Beddua,2018,15 Jun 2018,N/A,Horror,Alper Mestçi,Alper Mestçi,N/A,N/A,Turkey,N/A,,N/A,N/A,N/A,tt7738930,movie,N/A,N/A
tt7741602,674,Until Midnight,2018,19 Jun 2018,78 min,"Drama, Thriller",Tariq Alkazim,Tariq Alkazim,"Ahmed Khamis Ali, Chuka Ekweogwu, Hiba Hamoui, Rik Aby","When Salem, A newly wed man returns home, He finds an unexpected visitor with sinister intentions.",United Arab Emirates,N/A,,N/A,8.1,652,tt7741602,movie,N/A,N/A
tt7745068,2413,Boku no Hero Academia the Movie,2018,25 Sep 2018,96 min,"Animation, Action, Comedy, Fantasy",Kenji Nagasaki,"Kôhei Horikoshi (manga), Yôsuke Kuroda (script writer), Kôhei Horikoshi (story)","Justin Briner, Christopher Sabat, Ray Chase, Erica Mendez",All Might and Deku accept an invitation to visit a floating man-made city called I Island where they meet a girl and battle against a villain who takes the island hostage.,Japan,N/A,,N/A,8.0,"2,246",tt7745068,movie,N/A,N/A
tt7748226,785,Rüzgar,2018,19 Jan 2018,94 min,"Comedy, Family, Romance",Serkan Acar,Volkan Girgin,"Belçim Bilgin, Sezai Paracikoglu, Ata Berk Mutlu, Cezmi Baskin","At the age of 35, Ece is the assistant general manager of a company that produces baby diapers. There is a happy relationship with her lover Alper. Because of Ece, they can not get married....",Turkey,N/A,,N/A,5.9,699,tt7748226,movie,N/A,N/A
tt7748244,10258,Ölümlü Dünya,2018,26 Jan 2018,107 min,"Action, Comedy",Ali Atay,"Ali Atay, Ali Demirel, Aziz Kedi, Volkan Sümbül, Feyyaz Yigit","Ahmet Mümtaz Taylan, Alper Kul, Sarp Apak, Irem Sak","8 membered Mermer Family which works in Tat Resaurant for a long time in Haydarpasa Station, faces the consequences after a secret of theirs comes into the open.",Turkey,N/A,,N/A,7.9,"8,471",tt7748244,movie,N/A,N/A
tt7748426,4417,Ailecek Saskiniz,2018,02 Mar 2018,113 min,Comedy,Selçuk Aydemir,Selçuk Aydemir,"Ahmet Kural, Murat Cemcir, Saadet Aksoy, Cengiz Bozkurt","Ferhat is a spoiled man who takes over his father's company. Ferhat's right hand is his childhood friend, the company's finance manager, Gökhan. They are not very kind to their employees. ...",Turkey,N/A,,N/A,6.5,"4,231",tt7748426,movie,N/A,N/A
