ID,Votes,Title,Year,Released,Runtime,Genre,Director,Writer,Actors,Plot,Country,Awards,RT_Ratings,Metascore,imdbRating,imdbVotes,imdbID,Type,BoxOffice,Production
tt6543652,29251,Cold War,2018,22 Mar 2019,89 min,"Drama, Music, Romance",Pawel Pawlikowski,"Pawel Pawlikowski (story), Pawel Pawlikowski (screenplay), Janusz Glowacki (screenplay), Piotr Borkowski (screenplay with the collaboration of)","Joanna Kulig, Tomasz Kot, Borys Szyc, Agata Kulesza","In the 1950s, a music director falls in love with a singer and tries to persuade her to flee communist Poland for France.","Poland, UK, France",1 nomination.,90/100,90,7.7,"27,952",tt6543652,movie,N/A,N/A
tt6545212,792,Leera the Soulmate,2018,24 Aug 2018,N/A,Animation,Sumnash Sri Kaljai,Usha Kaljai,"Mehul Adwani, Leera Kaljai",Leera the soulmate is an upcoming Indian space adventure love story film directed by Sumnash Sri Kaljai produced by Usha Kaljai under the banner of Kaljaimovies . Leera Kaljai and Mehul ...,India,N/A,,N/A,N/A,N/A,tt6545212,movie,N/A,N/A
tt6547170,3715,Reprisal,2018,31 Aug 2018,89 min,"Action, Crime, Thriller",Brian A. Miller,Bryce Hammons,"Bruce Willis, Frank Grillo, Johnathon Schaech, Olivia Culpo","A bank manager haunted by a violent heist that took the life of a coworker teams up with his ex-cop neighbor to bring down the assailant, initiating an explosive counterattack that brings all three men to the breaking point.","UK, USA",N/A,0%,19,4.2,"3,572",tt6547170,movie,N/A,Lionsgate
tt6556576,1216,Monster Party,2018,02 Nov 2018,89 min,"Horror, Mystery, Thriller",Chris von Hoffmann,Chris von Hoffmann,"Sam Strike, Virginia Gardner, Brandon Micheal Hall, Kian Lawley",Three teenage thieves infiltrate a mansion dinner party secretly hosted by a group of recovering murderers for the social elite.,USA,N/A,69%,58,5.3,"1,194",tt6556576,movie,N/A,RLJ Entertainment
tt6559390,775,The Apparition,2018,07 Sep 2018,144 min,Drama,Xavier Giannoli,"Jacques Fieschi (collaboration), Xavier Giannoli (screenplay), Marcia Romano (collaboration)","Vincent Lindon, Galatéa Bellugi, Patrick d'Assumçao, Anatole Taubman",A journalist is sent by the Vatican to investigate a young girl claiming to be visited by the Virgin Mary.,"France, Belgium, Jordan",N/A,64/100,64,6.4,719,tt6559390,movie,N/A,N/A
tt6566830,580,Most Likely to Murder,2018,12 Mar 2018,90 min,Comedy,Dan Gregor,"Dan Gregor, Doug Mand","Billy Eichner, Rachel Bloom, Vincent Kartheiser, Didi Conn","A home for the holidays murder-mystery comedy - former high-school hero Billy (Adam Pally) comes back to his hometown expecting things to be like they used to. Instead, he finds all his ...",USA,N/A,62%,N/A,5.2,580,tt6566830,movie,N/A,Lionsgate
tt6576556,1781,The Silent Revolution,2018,01 Mar 2018,111 min,"Drama, History",Lars Kraume,"Dietrich Garstka (book), Lars Kraume (adaptation)","Leonard Scheicher, Tom Gramenz, Lena Klenke, Isaiah Michalski",A group of twelfth-grade pupils decide to show their solidarity with the victims of the 1956 Hungarian uprising by staging two minutes of silence during lessons.,Germany,N/A,,N/A,7.4,"1,784",tt6576556,movie,N/A,N/A
tt6577798,604,Humble Politician Nograj,2018,02 Feb 2018,149 min,"Comedy, Drama",Saad Khan,"Saad Khan (screenplay), Danish Sait (story), Saad Khan (story), Danish Sait (dialogue), Vamsidhar Bhogaraju (dialogue), Saad Khan (dialogue)","Danish Sait, Sumukhi Suresh, Sruthi Hariharan, Vijay Chendoor","Danish plays the title character of Nograj, a narcissistic crazy politician who exploits a city and its resources. The film is about Nograj's aspirations to becoming the MLA in the upcoming elections and the opposition he faces.",India,N/A,,N/A,7.3,410,tt6577798,movie,N/A,Pushkar Films
tt6580564,4641,102 Not Out,2018,04 May 2018,102 min,"Comedy, Drama",Umesh Shukla,Saumya Joshi,"Amitabh Bachchan, Rishi Kapoor, Jimit Trivedi, Dharmendra Gohil","102 Not Out is a 2018 comedy-drama film, with legendary actor Amitabh Bachchan playing a 102-year-old wanting to break the oldest-man-alive record. Another Bollywood legend Rishi Kapoor plays his sad and grumpy 75-year-old son.",India,N/A,70%,N/A,7.5,"4,640",tt6580564,movie,N/A,Treetop Entertainment
tt6588966,6983,Hichki,2018,23 Mar 2018,116 min,"Comedy, Drama",Siddharth Malhotra,"Anckur Chaudhry (story and screenplay), Siddharth Malhotra (story and screenplay), Ambar Hadap (story and screenplay), Ganesh Pandit (story and screenplay), Anckur Chaudhry (dialogue)","Rani Mukerji, Neeraj Kabi, Ivan Rodrigues, Leena Acharya",Hichki presents a positive and inspiring story about a woman who turns her biggest weakness into her biggest strength.,India,N/A,56%,N/A,7.5,"6,868",tt6588966,movie,N/A,Yash Raj Films USA
tt6591616,528,Veljeni vartija,2018,31 Jan 2018,N/A,"Biography, Drama, Music",Jukka-Pekka Siili,"Aleksi Bardy, Jukka-Pekka Siili","Antti Holma, Niklas Liukkonen, Julius Liukkonen, Eemeli Masanen",N/A,Finland,N/A,,N/A,3.2,46,tt6591616,movie,N/A,N/A
tt6598072,808,The Ranger,2018,17 Aug 2018,77 min,Horror,Jenn Wexler,"Giaco Furino, Jenn Wexler","Chloe Levine, Jeremy Holm, Granit Lahu, Jeremy Pope","Teen punks, on the run from the cops and hiding out in the woods, come up against the local authority - an unhinged park ranger with an axe to grind.",USA,N/A,73%,54,5.2,716,tt6598072,movie,N/A,Glass Eye Pix
tt6599742,1742,Sara's Notebook,2018,02 Feb 2018,115 min,"Adventure, Drama, Mystery, Thriller",Norberto López Amado,Jorge Guerricaechevarría,"Belén Rueda, Marian Álvarez, Iván Mendes, Manolo Cardona","Laura Alonso is a Spanish lawyer from Madrid who sets off to Democratic Republic of Congo (center of Africa) after having seen a photo where Sara, her younger sister, appears alive after ...",Spain,N/A,,N/A,6.0,"1,719",tt6599742,movie,N/A,N/A
tt6605812,690,Eternal Winter,2018,25 Feb 2018,110 min,"Drama, History, Romance",Attila Szász,"Norbert Köbli (screenplay by), Attila Szász (screenplay by), János Havasi (book)","Marina Gera, Sándor Csányi, Laura Döbrösi, Diána Magdolna Kiss",The true story of an unlikely romance in a Soviet labor camp.,Hungary,N/A,,N/A,7.5,650,tt6605812,movie,N/A,N/A
tt6610158,1870,Rust Creek,2018,04 Jan 2019,108 min,"Drama, Thriller",Jen McGowan,"Julie Lipson, Stu Pollard (story by)","Hermione Corfield, Denise Dal Vera, Jeremy Glazer, Laura Guzman",An overachieving college student gets lost on her way to a job interview. A wrong turn leaves her stranded deep in the Kentucky forest. The woman must defend herself against the harsh ...,USA,N/A,85%,59,5.7,"1,790",tt6610158,movie,N/A,IFC Midnight
tt6613812,808,Seeking Happily Ever After,2018,18 May 2018,104 min,Drama,Harish Vyas,"Aryan Saha (screenplay), Aryan Saha, Harish Vyas (screenplay), Harish Vyas (story), Harish Vyas","Shivani Raghuvanshi, Anshuman Jha, Ekavali Khanna, Sanjay Mishra",Angrezi Mein Kehte Hein is a family drama and explores changing relationships between a middle aged couple. Its about the realization that sometimes just loving someone is not enough and expressing that love is equally important.,India,2 wins.,,N/A,6.8,801,tt6613812,movie,N/A,Drumroll Pictures
tt6613878,973,Clara,2018,28 Oct 2018,105 min,Sci-Fi,Akash Sherman,"Akash Sherman, Akash Sherman (story by), James Ewasiuk (story by)","Patrick J. Adams, Troian Bellisario, Will Bowes, Jennifer Dale","An obsessive astronomer and a curious artist form an unlikely bond which leads them to a profound, scientific discovery.","USA, Canada",N/A,50%,N/A,7.0,775,tt6613878,movie,N/A,Serendipity Point Films
tt6615894,846,Ranam,2018,07 Sep 2018,136 min,"Action, Crime, Drama, Thriller",Nirmal Sahadev,"George Kanatt (dialogue), Nirmal Sahadev","Prithviraj Sukumaran, Rahman, Giju John, Isha Talwar","Trapped in a life of crime, a mysterious getaway driver, lives with this code of conduct and protects his only friend. When he meets someone who can potentially change his entire world, he yearns at a chance for redemption.","India, USA",N/A,,N/A,6.8,791,tt6615894,movie,N/A,N/A
tt6628102,10459,The Wild Pear Tree,2018,30 Jan 2019,188 min,Drama,Nuri Bilge Ceylan,"Akin Aksu, Ebru Ceylan, Nuri Bilge Ceylan","Dogu Demirkol, Murat Cemcir, Bennu Yildirimlar, Hazar Ergüçlü","An unpublished writer returns to his hometown after graduating, where he seeks sponsors to publish his book while dealing with his father's deteriorating indulgence into gambling.","Turkey, Republic of Macedonia, France, Germany, Bosnia and Herzegovina, Bulgaria, Sweden",N/A,86/100,86,8.3,"9,409",tt6628102,movie,N/A,N/A
tt6628394,74968,Bad Times at the El Royale,2018,12 Oct 2018,141 min,"Crime, Drama, Mystery, Thriller",Drew Goddard,Drew Goddard,"Jeff Bridges, Cynthia Erivo, Dakota Johnson, Jon Hamm","Circa 1969, several strangers, most with a secret to bury, meet by chance at Lake Tahoe's El Royale, a rundown hotel with a dark past. Over the course of one night, everyone will show their true colors - before everything goes to hell.",USA,N/A,75%,60,7.1,"69,971",tt6628394,movie,N/A,20th Century Fox
tt6633182,583,Dark Money,2018,13 Jul 2018,99 min,Documentary,Kimberly Reed,"Kimberly Reed, Jay Arthur Sterrenberg",N/A,"DARK MONEY, a political thriller, examines one of the greatest present threats to American democracy: the influence of untraceable corporate money on our elections and elected officials. ...",USA,1 nomination.,95%,72,7.1,566,tt6633182,movie,N/A,PBS
tt6634646,919,"Hale County This Morning, This Evening",2018,14 Sep 2018,76 min,Documentary,RaMell Ross,"Maya Krinsky, RaMell Ross","Latrenda 'Boosie' Ash, Quincy Bryant, Daniel Collins, RaMell Ross","A kaleidoscopic and humanistic view of the Black community in Hale County, Alabama.",USA,1 nomination.,97%,85,6.5,645,tt6634646,movie,N/A,The Cinema Guild
tt6644200,286325,A Quiet Place,2018,06 Apr 2018,90 min,"Drama, Horror, Mystery, Sci-Fi, Thriller",John Krasinski,"Bryan Woods (screenplay by), Scott Beck (screenplay by), John Krasinski (screenplay by), Bryan Woods (story by), Scott Beck (story by)","Emily Blunt, John Krasinski, Millicent Simmonds, Noah Jupe","In a post-apocalyptic world, a family is forced to live in silence while hiding from monsters with ultra-sensitive hearing.",USA,N/A,95%,82,7.6,"282,205",tt6644200,movie,N/A,Paramount Pictures
tt6650364,784,Carbon,2018,19 Jan 2018,146 min,"Adventure, Thriller",Venu Goopaalan,Venu Goopaalan,"Fahadh Faasil, Mamta Mohandas, Manikandan R. Achari, Chethan Jayalal","Sibi Sebastian and his never ending struggle to make it big in life, his quest for new horizons and opportunities. While others pass by, his relentless determination takes him to the most unexpected situation in his life.",India,N/A,,N/A,6.9,763,tt6650364,movie,N/A,Poetry Film House
tt6652708,2436,God's Not Dead: A Light in Darkness,2018,30 Mar 2018,105 min,Drama,Michael Mason,"Michael Mason, Howard Klausner","Megan Alexander, Adeeja Rochele Anderson, Carrlyn Bathe, Lauren Taylor Berkman","Pastor Dave responds to the unimaginable tragedy of having his church, located on the grounds of the local university, burned down.",USA,N/A,11%,33,4.4,"2,440",tt6652708,movie,N/A,Pure Flix Entertainment
tt6662736,1569,What They Had,2018,29 Nov 2018,101 min,Drama,Elizabeth Chomko,Elizabeth Chomko,"Hilary Swank, Michael Shannon, Robert Forster, Blythe Danner",Bridget returns home at her brother's urging to deal with her ailing mother and her father's reluctance to let go of their life together.,USA,N/A,88%,69,6.6,"1,536",tt6662736,movie,N/A,Bleecker Street
tt6663582,43251,The Spy Who Dumped Me,2018,03 Aug 2018,117 min,"Action, Adventure, Comedy",Susanna Fogel,"Susanna Fogel, David Iserson","Justin Theroux, Blanka Györfi-Tóth, Vilma Szécsi, Mila Kunis",Audrey and Morgan are best friends who unwittingly become entangled in an international conspiracy when one of the women discovers the boyfriend who dumped her was actually a spy.,"USA, Canada",N/A,49%,52,6.0,"41,841",tt6663582,movie,N/A,Lionsgate
tt6675244,2540,Transit,2018,01 Mar 2019,101 min,Drama,Christian Petzold,"Christian Petzold (adaptation), Anna Seghers (novel)","Franz Rogowski, Paula Beer, Godehard Giese, Lilien Batman","When a man flees France after the Nazi invasion, he assumes the identity of a dead author whose papers he possesses. Stuck in Marseilles, he meets a young woman desperate to find her missing husband - the very man he's impersonating.","Germany, France",N/A,96%,83,7.0,"2,439",tt6675244,movie,N/A,Music Box Films
tt6676028,1039,In a Relationship,2018,20 Apr 2018,92 min,"Comedy, Drama",Sam Boyd,Sam Boyd (screenplay by),"Emma Roberts, Michael Angarano, Dree Hemingway, Patrick Gibson","Long-term couple Owen and Hallie are breaking up (or maybe not?). Just as their relationship reaches a turning point, Matt and Willa embark on a romance of their own. A funny, deeply felt ...","Mexico, USA",N/A,60%,51,5.4,812,tt6676028,movie,N/A,Vertical Entertainment
tt6678874,1010,Incoming,2018,25 May 2018,89 min,"Action, Sci-Fi, Thriller",Eric Zaragoza,"Rick Benattar (story), Jorge Saralegui (screenplay), Jorge Saralegui (story), Nigel Thomas (story)","Scott Adkins, Aaron McCusker, Michelle Lehane, Vahidin Prelic",The International Space Station is now a prison - the ultimate black site. No one's getting out. And no one knows it's there. But when the imprisoned terrorists take over the Station and ...,"Serbia, USA",N/A,,N/A,3.3,985,tt6678874,movie,N/A,N/A
tt6679412,886,Forgive Us Our Debts,2018,04 May 2018,104 min,Drama,Antonio Morabito,"Antonio Morabito, Amedeo Pagani","Claudio Santamaria, Marco Giallini, Jerzy Stuhr, Flonja Kodheli",A man struggling under the crushing weight of debt must work as a tax collector to pay off his creditors.,"Italy, Switzerland, Albania, Poland",N/A,,N/A,6.2,848,tt6679412,movie,N/A,Netflix
tt6679794,42155,Outlaw King,2018,09 Nov 2018,121 min,"Action, Biography, Drama, History, War",David Mackenzie,"Bathsheba Doran (screenplay by), David Mackenzie (screenplay by), James MacInnes (screenplay by), David Harrower (additional writing by), Mark Bomback (additional writing by)","Chris Pine, Stephen Dillane, Rebecca Robin, Billy Howle",A true David vs. Goliath story of how the 14th century Scottish 'Outlaw King' Robert the Bruce used cunning and bravery to defeat the much larger and better equipped occupying English army.,"UK, USA",N/A,62%,59,7.0,"41,419",tt6679794,movie,N/A,Netflix
tt6680730,1062,Streetlights,2018,26 Jan 2018,N/A,"Crime, Thriller",Shamdat Sainudeen,N/A,"Mammootty, Vishnu Unnikrishnan, Lijo Mol Jose",N/A,India,N/A,,N/A,N/A,N/A,tt6680730,movie,N/A,N/A
tt6684714,7513,Acts of Violence,2018,12 Jan 2018,86 min,"Action, Crime",Brett Donowho,Nicolas Aaron Mezzanatto (screen play by),"Bruce Willis, Cole Hauser, Shawn Ashmore, Ashton Holmes","When his fiancee is kidnapped by human traffickers, Roman (Ashton Holmes) and his ex-military brothers set out to track her down and save her before it is too late. Along the way, Roman ...",Canada,N/A,0%,28,5.2,"7,415",tt6684714,movie,N/A,Lionsgate Premiere
tt6684884,2223,Ladies in Black,2018,20 Sep 2018,109 min,"Comedy, Drama",Bruce Beresford,"Madeleine St. John (based on the novel: ""The Women in Black"" by), Sue Milliken (screenplay), Bruce Beresford (screenplay)","Julia Ormond, Angourie Rice, Rachael Taylor, Alison McGirr","Adapted from the bestselling novel by Madeleine St John, Ladies in Black is an alluring and tender-hearted comedy drama about the lives of a group of department store employees in 1959 Sydney.",Australia,N/A,83%,N/A,6.7,"1,978",tt6684884,movie,N/A,N/A
tt6685596,518,Maya the Bee: The Honey Games,2018,27 Apr 2018,85 min,"Animation, Adventure, Comedy, Family","Noel Cleary, Sergio Delfino, Alexs Stadermann(co-director)","Waldemar Bonsels (characters), Noel Cleary (story), Fin Edquist (story), Collin McMahon (script translator), Kevin Peaty (addtl. story artist), Alexs Stadermann (story), Christopher Weekes","Coco Jack Gillies, Benson Jack Anthony, Richard Roxburgh, Justine Clarke","When an overenthusiastic Maya accidentally embarrasses the Empress of Buzztropolis, she is forced to unite with a team of misfit bugs and compete in the Honey Games for a chance to save her hive.","Germany, Australia",N/A,,N/A,5.6,508,tt6685596,movie,N/A,SHOUT! STUDIOS
tt6690004,915,The Freshman,2018,12 Sep 2018,92 min,N/A,Thomas Lilti,Thomas Lilti,"Vincent Lacoste, William Lebghil, Michel Lerousseau, Darina Al Joundi",Friendship sparks between newcomer Benjamin and held-back Antoine during the first year of medical school.,France,N/A,,N/A,6.7,714,tt6690004,movie,N/A,N/A
tt6697582,24824,Arif V 216,2018,05 Jan 2018,125 min,"Comedy, Sci-Fi",Kivanç Baruönü,Cem Yilmaz,"Cem Yilmaz, Ozan Güven, Özkan Ugur, Özge Özberk","After 8 years, Arif's old friend 216 from planet GORA pays a visit to Earth.Together they go on a quest where they'll be visiting 60's.",Turkey,N/A,,N/A,7.5,"24,564",tt6697582,movie,N/A,N/A
tt6699860,1379,Solo,2018,03 Aug 2018,91 min,"Adventure, Drama, Romance",Hugo Stuven,"Santiago Lallana, Hugo Stuven","Alain Hernández, Aura Garrido, Ben Temple, Leticia Etala","After falling by a cliff on a desert beach, a seriously injured surfer starts a lonely fight to survive against the merciless nature.",Spain,N/A,,N/A,4.9,"1,380",tt6699860,movie,N/A,N/A
tt6704776,2933,The Photographer of Mauthausen,2018,26 Oct 2018,110 min,"Biography, Drama, History, Thriller",Mar Targarona,"Roger Danès, Alfred Pérez Fargas","Mario Casas, Richard van Weyden, Alain Hernández, Adrià Salazar","Based on real events, Francesc Boix is a Spaniard inmate in the Austrian concentration camp of Mauthausen who tries to save the evidences of the horrors committed inside its walls.",Spain,N/A,80%,N/A,6.7,886,tt6704776,movie,N/A,N/A
tt6704880,568,Girls of the Sun,2018,21 Nov 2018,115 min,"Drama, War",Eva Husson,"Jacques Akchoti (collaboration), Eva Husson (screenplay)","Golshifteh Farahani, Emmanuelle Bercot, Zübeyde Bulut, Sinama Alievi",A Kurdish female battalion prepares to take back their town from extremists.,"France, Belgium, Georgia, Switzerland",1 nomination.,59/100,59,6.0,515,tt6704880,movie,N/A,N/A
tt6707906,2665,Odiyan,2018,14 Dec 2018,167 min,"Action, Drama, Fantasy, Thriller",V.A. Shrikumar Menon,"Harikrishnan, Harikrishnan","Mohanlal, Prakash Raj, Manju Warrier, Manoj Joshi","The story of the Odiyan clan, one of the most dreaded, shape-shifting black magicians in the world which ruled the darkness of night through during the pre-electrification era in Kerala.",India,N/A,,N/A,6.0,"2,573",tt6707906,movie,N/A,N/A
tt6708044,1359,The Tribe,2018,16 Mar 2018,90 min,Comedy,Fernando Colomo,"Fernando Colomo, Yolanda García Serrano, Joaquín Oristrell","Paco León, Carmen Machi, Maribel del Pino, María José Sarrate","A cleaner woman with vocational street dancer tries to recover her long-stranded son that she gave for adoption, a former CEO who lost everything, including his memories.",Spain,2 wins.,,N/A,5.8,"1,303",tt6708044,movie,N/A,N/A
tt6708116,1876,Bad Seeds,2018,21 Nov 2018,100 min,Comedy,Kheiron,"Kheiron (dialogue), Kheiron (screenplay)","Kheiron, Catherine Deneuve, André Dussollier, Louison Blivet","Wael (Kheiron) a former street child, makes a living from small scams with his adoptive mother and partner-in-crime Monique (Catherine Deneuve). When this unconventional duo swindles the ...","France, Belgium",N/A,,N/A,7.3,"1,791",tt6708116,movie,N/A,N/A
tt6710826,1414,The Jurassic Games,2018,28 Dec 2018,86 min,"Action, Adventure, Horror, Sci-Fi, Thriller",Ryan Bellgardt,"Ryan Bellgardt, Galen Christy (story by)","Ryan Merriman, Perrey Reeves, Adam Hampton, Katie Burgess","In the near future, 10 death row convicts are forced to compete in a virtual reality game that pits them against dinosaurs and each other.",USA,N/A,80%,N/A,3.7,"1,414",tt6710826,movie,N/A,High Octane Pictures
tt6727296,1912,Bhaagamathie,2018,26 Jan 2018,138 min,"Action, Horror, Thriller","Ashok G., Ashok G.",Ashok G.,"Anushka Shetty, Unni Mukundan, Rajsekhar Aningi, Prabhu","IAS officer Chanchala Reddy is imprisoned in a haunted house, while she is interrogated by law enforcers investigating a politician they suspect of corruption.",India,N/A,,N/A,7.0,"1,901",tt6727296,movie,N/A,UV Creations
tt6728096,3437,The Breaker Upperers,2018,03 May 2018,90 min,Comedy,"Madeleine Sami, Jackie van Beek","Madeleine Sami, Jackie van Beek","Madeleine Sami, Jackie van Beek, James Rolleston, Celia Pacquola","For the right price, BFFs Jen and Mel will ruthlessly end any romance. But when one grows a conscience, it threatens to derail their relationship.",New Zealand,N/A,90%,76,5.9,"3,170",tt6728096,movie,N/A,Netflix
tt6729000,506,Tyrel,2018,05 Dec 2018,86 min,"Comedy, Drama",Sebastián Silva,Sebastián Silva,"Christopher Abbott, Trust Arancio, Nicolas Arze, Max Born","Tyler, a sole black man, attends an otherwise all-white weekend of drunken bro debauchery on a birthday trip to a cabin in the Catskills.",USA,1 nomination.,63%,71,5.3,475,tt6729000,movie,N/A,Magnolia Pictures
tt6730898,1883,Lazer Team 2,2018,13 Nov 2017,86 min,Sci-Fi,"Daniel Fabelo, Matt Hullum","Burnie Burns (screenplay), Daniel Fabelo (screenplay), Matt Hullum (screenplay)","Burnie Burns, Gavin Free, Michael Jones, Colton Dunn","After one of their own is lost in another dimension, the Lazer Team groups together once again to fight against a new threat.",USA,N/A,,N/A,6.1,"1,843",tt6730898,movie,N/A,N/A
tt6730970,1166,Wiro Sableng 212,2018,30 Aug 2018,123 min,"Action, Adventure, Comedy, Fantasy",Angga Dwimas Sasongko,"Seno Gumira Ajidarma, Tumpal Tampubolon, Sheila Timothy","Vino G. Bastian, Yayan Ruhian, Fariz Alfarazi, Ruth Marini","Indonesia, the 16th century, Wiro Sableng, a disciple from a mysterious Warrior named Sinto Gendeng, got a mission from his Master to take down Mahesa Birawa, her former disciple who betrayed her.",Indonesia,N/A,,N/A,7.5,"1,164",tt6730970,movie,N/A,N/A
tt6742252,21204,The Guilty,2018,19 Oct 2018,85 min,"Crime, Drama, Thriller",Gustav Möller,"Gustav Möller (screenplay), Emil Nygaard Albertsen (screenplay)","Jakob Cedergren, Jessica Dinnage, Omar Shargawi, Johan Olsen",A police officer assigned alarm dispatch duty enters a race against time when he answers an emergency call from a kidnapped woman.,Denmark,3 wins & 2 nominations.,83/100,83,7.6,"19,502",tt6742252,movie,N/A,N/A
tt6744044,3168,Candy Jar,2018,27 Apr 2018,92 min,Comedy,Ben Shelton,Chad Klitzman,"Jacob Latimore, Sami Gayle, Tom Bergeron, Helen Hunt",Dueling high school debate champs who are at odds on just about everything forge ahead with ambitious plans to get into the colleges of their dreams.,USA,N/A,71%,N/A,5.8,"3,150",tt6744044,movie,N/A,Netflix
tt6746304,1036,Pity,2018,28 Sep 2018,97 min,Drama,Babis Makridis,"Efthymis Filippou, Babis Makridis","Evdoxia Androulidaki, Georgina Chryskioti, Yannis Drakopoulos, Makis Papadimitriou","The story of a man who feels happy only when he is unhappy, a man addicted to sadness, who has such need for pity, he's willing to do everything to evoke it from others. This is the life of a man in a world not cruel enough for him.","Greece, Poland",2 nominations.,75%,77,6.7,"1,002",tt6746304,movie,N/A,N/A
tt6747420,1154,Rajma Chawal,2018,30 Nov 2018,117 min,"Comedy, Drama, Family",Leena Yadav,"Vivek Anchalia (screenplay), Vivek Anchalia (story), Manu Rishi Chadha (dialogue), Manu Rishi Chadha (screenplay), Leena Yadav (screenplay)","Amyra Dastur, Aparshakti Khurana, Rishi Kapoor, Sheeba Chaddha",An internet-rookie father attempts to use social media to enhance his faltering relationship with his millennial son.,India,N/A,,N/A,5.7,"1,120",tt6747420,movie,N/A,Netflix
tt6748466,3436,Loro 1,2018,24 Apr 2018,104 min,"Biography, Drama",Paolo Sorrentino,"Paolo Sorrentino (story), Paolo Sorrentino (screenplay), Umberto Contarello (screenplay)","Toni Servillo, Elena Sofia Ricci, Riccardo Scamarcio, Kasia Smutniak",A film about the life of Silvio Berlusconi.,"Italy, France",N/A,,N/A,6.8,"3,268",tt6748466,movie,N/A,Indigo Film
tt6749318,1290,Speed Kills,2018,16 Aug 2018,102 min,"Action, Crime, Drama, Thriller",Jodi Scurfield,"David Aaron Cohen (screenplay by), John Luessenhop (screenplay by), Paul Castro (story by), John Luessenhop (story by), David Aaron Cohen (story by), Arthur Jay Harris (based upon the book ""Speed Kills"" by)","John Travolta, Katheryn Winnick, Jennifer Esposito, Michael Weston","Speedboat racing champion and multimillionaire, Ben Aronoff, leads a double life that lands him in trouble with the law and drug lords.",Puerto Rico,N/A,0%,19,4.0,"1,181",tt6749318,movie,N/A,Saban Films
tt6750884,994,Poramon 2,2018,16 Jun 2018,N/A,"Drama, Romance",Raihan Rafi,N/A,"Siam Ahmed, Puja Cherry Roy, Prem Khan, Roshan","The only girl of day laborer Kafil Mia, Jasmine, committed suicide by hanging herself on the darkness of the night, because her lover Kabir betrayed her. Since self-murder is not accepted ...",Bangladesh,N/A,,N/A,5.5,385,tt6750884,movie,N/A,N/A
tt6752992,6049,Happy as Lazzaro,2018,30 Nov 2018,125 min,Drama,Alice Rohrwacher,Alice Rohrwacher,"Alba Rohrwacher, David Bennent, Sergi López, Nicoletta Braschi",An unceasingly kind Italian peasant and his family are blatantly exploited by a tobacco baroness.,"Italy, Switzerland, France, Germany",N/A,86/100,86,7.7,"5,732",tt6752992,movie,N/A,N/A
tt6755366,786,Bad Poems,2018,27 Dec 2018,97 min,"Comedy, Drama",Gábor Reisz,Gábor Reisz,"Gábor Reisz, Katica Nagy, Zsolt Kovács, Katalin Takács","33-years old Tamás Merthner is heartbroken, after his girlfriend Anna, who is on a scholarship in Paris, breaks up with him. While wallowing in self-pity, Tamás takes a trip down memory ...",Hungary,N/A,,N/A,8.1,531,tt6755366,movie,N/A,N/A
